{
  "$schema": "https://json-schema.org/draft/2020-12/schema",
  "title": "Frontend AI assignment manifest",
  "type": "object",
  "required": [
    "manifest_version",
    "repository",
    "id",
    "title",
    "kind",
    "status",
    "risk",
    "timebox_minutes",
    "journey",
    "owner_role",
    "review_team_roles",
    "related_issues",
    "depends_on",
    "inputs",
    "objective",
    "in_scope",
    "out_of_scope",
    "constraints",
    "ai_steps",
    "deliverables",
    "acceptance",
    "learning_check",
    "handoff",
    "completion_record",
    "developer_guide"
  ],
  "properties": {
    "manifest_version": {
      "const": 1
    },
    "id": {
      "type": "string",
      "pattern": "^UI-[0-9]{3}$"
    },
    "title": {
      "type": "string",
      "minLength": 10
    },
    "kind": {
      "enum": ["research", "specification", "wireframe", "visual_design", "api_contract"]
    },
    "status": {
      "enum": [
        "ready_for_research",
        "waiting_for_reviewed_input",
        "claimed",
        "in_review",
        "accepted",
        "needs_revision"
      ]
    },
    "risk": {
      "enum": ["Green", "Yellow", "Red"]
    },
    "timebox_minutes": {
      "type": "integer",
      "minimum": 30,
      "maximum": 120
    },
    "github_issue": {
      "type": ["string", "null"]
    },
    "journey": {
      "type": "string",
      "minLength": 10
    },
    "owner_role": {
      "type": "string",
      "minLength": 1
    },
    "review_team_roles": {
      "type": "array",
      "minItems": 2,
      "uniqueItems": true,
      "items": {
        "type": "string"
      }
    },
    "related_issues": {
      "type": "array",
      "items": {
        "type": "string"
      }
    },
    "depends_on": {
      "type": "array",
      "uniqueItems": true,
      "items": {
        "type": "string",
        "pattern": "^UI-[0-9]{3}$"
      }
    },
    "inputs": {
      "type": "array",
      "minItems": 1,
      "items": {
        "type": "object",
        "required": ["reference", "purpose"],
        "properties": {
          "reference": {
            "type": "string"
          },
          "purpose": {
            "type": "string"
          }
        },
        "additionalProperties": false
      }
    },
    "objective": {
      "type": "string",
      "minLength": 20
    },
    "in_scope": {
      "$ref": "#/$defs/list"
    },
    "out_of_scope": {
      "$ref": "#/$defs/list"
    },
    "constraints": {
      "$ref": "#/$defs/list"
    },
    "ai_steps": {
      "type": "array",
      "minItems": 2,
      "maxItems": 4,
      "items": {
        "type": "object",
        "required": ["step", "prompt"],
        "properties": {
          "step": {
            "type": "string"
          },
          "prompt": {
            "type": "string",
            "minLength": 30
          }
        },
        "additionalProperties": false
      }
    },
    "deliverables": {
      "type": "array",
      "minItems": 1,
      "items": {
        "type": "object",
        "required": ["name", "format", "contents"],
        "properties": {
          "name": {
            "type": "string"
          },
          "format": {
            "type": "string"
          },
          "contents": {
            "type": "string"
          }
        },
        "additionalProperties": false
      }
    },
    "acceptance": {
      "$ref": "#/$defs/list"
    },
    "learning_check": {
      "type": "string"
    },
    "handoff": {
      "type": "string"
    },
    "completion_record": {
      "type": "object",
      "required": [
        "artifact_links",
        "review_team_members",
        "review_date",
        "accepted_revision",
        "contributor_explanation",
        "review_team_observation"
      ],
      "properties": {
        "artifact_links": {
          "type": "array",
          "items": {
            "type": "string"
          }
        },
        "review_team_members": {
          "type": "array",
          "uniqueItems": true,
          "items": {
            "type": "string",
            "minLength": 1
          }
        },
        "review_date": {
          "type": ["string", "null"]
        },
        "accepted_revision": {
          "type": ["string", "null"]
        },
        "contributor_explanation": {
          "type": ["string", "null"]
        },
        "review_team_observation": {
          "type": ["string", "null"]
        }
      },
      "additionalProperties": false
    },
    "repository": {
      "const": "hwillGIT/boston-circular-economy"
    },
    "developer_guide": {
      "const": "docs/work-units/DEVELOPER_AI_GUIDE.md"
    }
  },
  "$defs": {
    "list": {
      "type": "array",
      "minItems": 1,
      "items": {
        "type": "string",
        "minLength": 1
      }
    }
  },
  "additionalProperties": false,
  "allOf": [
    {
      "if": {
        "properties": {
          "status": {
            "const": "accepted"
          }
        },
        "required": ["status"]
      },
      "then": {
        "properties": {
          "completion_record": {
            "properties": {
              "artifact_links": {
                "minItems": 1
              },
              "review_team_members": {
                "minItems": 2
              },
              "review_date": {
                "type": "string",
                "minLength": 1
              },
              "accepted_revision": {
                "type": "string",
                "minLength": 1
              },
              "contributor_explanation": {
                "type": "string",
                "minLength": 1
              },
              "review_team_observation": {
                "type": "string",
                "minLength": 1
              }
            }
          }
        }
      }
    }
  ]
}
