{
  "manifest_version": 1,
  "journey": "MVP M2: senior resident finds a textile repair clinic",
  "owner_role": "Frontend work lead (Hubert)",
  "github_issue": "https://github.com/hwillGIT/boston-circular-economy/issues/3",
  "inputs": [
    {
      "reference": "https://docs.google.com/document/d/1eI7OL8zppM01br13fuhXvWKAKnKWhRBOJ45NMYenpHU/edit",
      "purpose": "Prototype requirements M2.1 and M2.2, screens 5 and 6"
    },
    {
      "reference": "https://patterns.boston.gov/",
      "purpose": "Official Boston component and visual guidance"
    },
    {
      "reference": "client/README.md",
      "purpose": "Existing React, TypeScript, Vite, and TanStack Router boundaries"
    },
    {
      "reference": "docs/work-units/DEVELOPER_AI_GUIDE.md",
      "purpose": "Prompts for clear code, plain explanations, and a contributor demonstration"
    }
  ],
  "constraints": [
    "Create issues and pull requests in hwillGIT/boston-circular-economy. Upstream issues are reference material.",
    "Use the current textile MVP, a 390-pixel mobile viewport, and Fleet conventions.",
    "Treat the older television persona and technical prototypes as historical context.",
    "Use two synthetic clinics. Do not infer that the backend supports the mock fields.",
    "Separate source facts, AI suggestions, and unresolved decisions.",
    "Do not implement production code, query paid APIs, collect personal data, or publish to Slack.",
    "Use the developer guide for clear code and plain explanations. Reserve the last 15 minutes for explaining and defending the result."
  ],
  "completion_record": {
    "artifact_links": [],
    "review_team_members": [],
    "review_date": null,
    "accepted_revision": null,
    "contributor_explanation": null,
    "review_team_observation": null
  },
  "id": "UI-001",
  "title": "Research clinic result cards and filters",
  "kind": "research",
  "status": "ready_for_research",
  "risk": "Green",
  "timebox_minutes": 60,
  "review_team_roles": ["Frontend work lead", "Product or design owner"],
  "related_issues": ["https://github.com/codeforboston/boston-circular-economy/issues/38"],
  "depends_on": [],
  "objective": "Identify the minimum information and interactions needed to compare two textile repair clinics.",
  "in_scope": [
    "M2.1 result cards and M2.2 filters",
    "Official Fleet patterns",
    "Existing design links and data gaps"
  ],
  "out_of_scope": [
    "New interviews or participant recruitment",
    "Choosing a frontend component library",
    "Maps, registration, accounts, and the full directory"
  ],
  "ai_steps": [
    {
      "step": "Brainstorm",
      "prompt": "Read this manifest and its sources. Propose three ways to organize a mobile clinic card and the five MVP filters. For each, explain the resident benefit, uncertainty, and maintenance cost. Cite sources. Do not invent interviews, approved designs, or available data. Stop after a 250-word comparison."
    },
    {
      "step": "Challenge",
      "prompt": "Act as a critical reviewer of the three proposals. Identify up to three assumptions about digital literacy, accessibility, and data availability. Compare each with M2.1 and M2.2. Reject unsupported claims. Give the contributor one question to answer from an actual source."
    },
    {
      "step": "Produce",
      "prompt": "Draft research-note.md in at most 600 words. Include an evidence table, three alternatives, one recommendation, open decisions, and a component-source list. Mark each claim as source fact, inference, or proposal. Ask me to verify every citation and explain one rejected AI suggestion."
    },
    {
      "step": "Explain and defend",
      "prompt": "Ask me to explain the recommended card layout in my own words. Wait for my answer. Ask which inspected source supports the choice. Ask why the closest alternative is less suitable. Change one assumption about the available clinic data. Ask whether my recommendation still holds and why. Check my answers against the sources. If I cite code, ask me to trace the relevant field. Do not write my explanation for me."
    }
  ],
  "deliverables": [
    {
      "name": "research-note.md",
      "format": "Markdown or linked Google Doc",
      "contents": "At most 600 words with evidence, alternatives, recommendation, and open decisions."
    },
    {
      "name": "source-and-pattern-list",
      "format": "Table in the research note",
      "contents": "MVP references, two inspected Fleet component pages, and the current design frame link or an explicit access gap."
    },
    {
      "name": "contributor-explanation",
      "format": "150-word note or three-minute recording",
      "contents": "Own explanation of the example, decision, alternative, evidence, failure behavior, and place to make a likely change."
    }
  ],
  "acceptance": [
    "The note covers services, cost, date, distance, and partial matches from M2.1.",
    "The note covers free, zip repair, machines, access/seating, and date filters from M2.2.",
    "Every reference is opened and checked by the contributor.",
    "The note identifies which clinic fields are absent or unproven in current DTOs.",
    "Hubert can select a recommendation or state one decision needed before specification.",
    "The contributor explains the result in their own words and answers one changed-case question from the review team.",
    "If the artifact contains code, the contributor locates the input, decision owner, visible result, and supporting behavior check.",
    "Names, types, and boundaries expose any generated code's purpose. Comments preserve reasons that the code cannot express.",
    "The explanation defines unfamiliar terms and states the evidence, limits, and condition for reconsidering the decision."
  ],
  "learning_check": "Explain one AI suggestion rejected after checking a source. Explain the choice in your own words. Support it with inspected evidence and answer one changed-case question.",
  "handoff": "Hubert reviews the research and selects the constraints for UI-002.",
  "repository": "hwillGIT/boston-circular-economy",
  "developer_guide": "docs/work-units/DEVELOPER_AI_GUIDE.md"
}
