{
  "manifest_version": 1,
  "journey": "MVP M2: senior resident finds a textile repair clinic",
  "owner_role": "Frontend work lead (Hubert)",
  "github_issue": "https://github.com/hwillGIT/boston-circular-economy/issues/7",
  "inputs": [
    {
      "reference": "https://docs.google.com/document/d/1eI7OL8zppM01br13fuhXvWKAKnKWhRBOJ45NMYenpHU/edit",
      "purpose": "Prototype requirements M2.1 and M2.2, screens 5 and 6"
    },
    {
      "reference": "https://patterns.boston.gov/",
      "purpose": "Official Boston component and visual guidance"
    },
    {
      "reference": "client/README.md",
      "purpose": "Existing React, TypeScript, Vite, and TanStack Router boundaries"
    },
    {
      "reference": "server/src/index.ts",
      "purpose": "Routes mounted by the fork's Express application"
    },
    {
      "reference": "server/src/routes/locations.ts",
      "purpose": "Implemented location reads to compare with proposed clinic data"
    },
    {
      "reference": "etl/src/etl/dtos.py",
      "purpose": "Available source fields and normalization boundaries"
    },
    {
      "reference": "docs/work-units/api-call-manifest.template.yaml",
      "purpose": "Starting structure for a proposed clinic-search contract"
    },
    {
      "reference": "docs/work-units/api-call-manifest.schema.json",
      "purpose": "Structural rules for the proposed clinic-search contract"
    },
    {
      "reference": "docs/work-units/DEVELOPER_AI_GUIDE.md",
      "purpose": "Prompts for clear code, plain explanations, and a contributor demonstration"
    }
  ],
  "constraints": [
    "Create issues and pull requests in hwillGIT/boston-circular-economy. Upstream issues are reference material.",
    "Use the current textile MVP, a 390-pixel mobile viewport, and Fleet conventions.",
    "Treat the older television persona and technical prototypes as historical context.",
    "Use two synthetic clinics. Do not infer that the backend supports the mock fields.",
    "Separate source facts, AI suggestions, and unresolved decisions.",
    "Do not implement production code, query paid APIs, collect personal data, or publish to Slack.",
    "Use the developer guide for clear code and plain explanations. Reserve the last 15 minutes for explaining and defending the result."
  ],
  "completion_record": {
    "artifact_links": [],
    "review_team_members": [],
    "review_date": null,
    "accepted_revision": null,
    "contributor_explanation": null,
    "review_team_observation": null
  },
  "id": "UI-005",
  "title": "Specify the clinic-search backend call",
  "kind": "api_contract",
  "status": "waiting_for_reviewed_input",
  "risk": "Yellow",
  "timebox_minutes": 90,
  "review_team_roles": ["Frontend work lead", "Backend/API lead"],
  "related_issues": [
    "https://github.com/codeforboston/boston-circular-economy/issues/38",
    "https://github.com/codeforboston/boston-circular-economy/issues/46",
    "https://github.com/codeforboston/boston-circular-economy/issues/53"
  ],
  "depends_on": ["UI-002"],
  "objective": "Propose the single backend read operation needed by the accepted results/filter UI.",
  "in_scope": [
    "One clinic-search operation",
    "Request/response examples and field provenance",
    "Mock data and frontend failure behavior"
  ],
  "out_of_scope": [
    "Implementing endpoints",
    "Registration, QR, writes, authentication, or hosting",
    "Choosing Express versus FastAPI",
    "Live user locations or real provider data"
  ],
  "ai_steps": [
    {
      "step": "Map",
      "prompt": "Read accepted UI-002 and the linked upstream API issues with their comments. Inspect server/src/index.ts, server/src/routes/locations.ts, and etl/src/etl/dtos.py at a recorded fork revision. Map every UI field to an implemented field or a data gap. Do not assume existing location routes support textile-clinic fields. Propose one read operation for Hubert and the backend lead."
    },
    {
      "step": "Challenge",
      "prompt": "Review the filter meanings, date and time units, distance origin, and pagination. Check empty results, missing values, partial matches, outdated responses, and cancellation. Check timeouts and recovery after a failed request. Do not infer machine availability or accessibility from missing data. Return at most five decisions that block implementation."
    },
    {
      "step": "Produce",
      "prompt": "Copy api-call-manifest.template.yaml into the assignment artifact. Draft success.json, empty.json, and error.json using synthetic clinics. Include proposed method/path, typed parameters, response fields, example statuses, action triggers, local-versus-server state, cancellation and retry rules, and field provenance. Run python -B .agents/scripts/check_delivery.py api-call --api-call-file api-call-manifest.yaml. Mark the contract proposed. Ask me and the backend lead to accept the same revision before any implementation."
    },
    {
      "step": "Explain and defend",
      "prompt": "Ask me to explain one request from the screen action through the backend response to the visible result. Wait for my answer. Ask which steps already exist and which steps are proposed. Ask why I selected this operation over its closest alternative. Compare missing machine data, a successful empty response, and a failed request. Ask me to predict each UI result. Ask where the controlling rule belongs. Check my answers against the code, examples, and proposed contract. Do not invent implementation evidence."
    }
  ],
  "deliverables": [
    {
      "name": "api-call-manifest.yaml",
      "format": "YAML",
      "contents": "Copy the API template. Validate it with the API schema. Record one proposed operation, UI action mapping, types, null/error semantics, data gaps, and acceptance record."
    },
    {
      "name": "success.json",
      "format": "JSON",
      "contents": "Two synthetic clinics consistent with the proposed response schema and machine filter."
    },
    {
      "name": "empty.json",
      "format": "JSON",
      "contents": "A valid successful response containing no matches."
    },
    {
      "name": "error.json",
      "format": "JSON",
      "contents": "The agreed error shape and retry guidance, separate from an empty result."
    },
    {
      "name": "contributor-explanation",
      "format": "150-word note or three-minute recording",
      "contents": "Own explanation of the example, decision, alternative, evidence, failure behavior, and place to make a likely change."
    }
  ],
  "acceptance": [
    "Every displayed or filtered field has provenance or an explicit unresolved data requirement.",
    "The manifest defines parameter encoding, defaults, date/time units, pagination, and result ordering.",
    "The examples conform to the same proposed contract and contain no personal data.",
    "The frontend behavior for empty, failure, cancellation, and stale responses is explicit.",
    "Hubert and the backend lead accept the same revision, or the unit ends with a clear decision request.",
    "The contributor explains the result in their own words and answers one changed-case question from the review team.",
    "If the artifact contains code, the contributor locates the input, decision owner, visible result, and supporting behavior check.",
    "Names, types, and boundaries expose any generated code's purpose. Comments preserve reasons that the code cannot express.",
    "The explanation defines unfamiliar terms and states the evidence, limits, and condition for reconsidering the decision."
  ],
  "learning_check": "Explain why a successful empty response differs from a failed request and how the UI handles each. Explain the choice in your own words. Support it with inspected evidence and answer one changed-case question.",
  "handoff": "Record the accepted contract in this fork's issue and relate it to the linked upstream API backlog. Create separate frontend and backend implementation units in this fork after acceptance.",
  "repository": "hwillGIT/boston-circular-economy",
  "developer_guide": "docs/work-units/DEVELOPER_AI_GUIDE.md"
}
